{
  "id": "echaudure",
  "noms": {
    "fr": "Échaudure des feuilles (leaf scald)",
    "mg": null,
    "sci": "Microdochium oryzae",
    "autres_noms_mg": []
  },
  "organes": {
    "feuille": [
      "taches irrégulières grisâtres à blanchâtres qui sèchent la pointe des feuilles"
    ]
  },
  "confusions": [],
  "conditions": {
    "ecosystemes": [],
    "altitude_m": [],
    "facteurs": []
  },
  "prevention": [
    "semences saines",
    "résidus de récolte retirés ou enfouis",
    "outils nettoyés entre parcelles",
    "avis d'un technicien avant tout traitement"
  ],
  "lutte_chimique": {
    "statut": "a_completer_liste_DPV",
    "produits": []
  },
  "sources": [
    {
      "titre": "Reconnaissance et gestion intégrée des principales maladies du riz (cours L2, école professionnelle supérieure agricole)",
      "fichier": "knowledge/sources/cours/Pathologie riz.pdf"
    },
    {
      "titre": "Importance des maladies de riz et proposition de lutte (Halitiana Rafalimanana, contexte malgache)",
      "fichier": "knowledge/sources/cours/Maladies de riz.pdf"
    }
  ],
  "taxonomy_ids": [
    "echaudure"
  ],
  "validation": {
    "par": null,
    "date": null,
    "statut": "brouillon"
  }
}
