{
  "id": "degats_chenilles",
  "noms": {
    "fr": "Feuilles enroulées ou mangées par des chenilles",
    "mg": null,
    "sci": "Nymphula sp., Parnara sp.",
    "autres_noms_mg": []
  },
  "organes": {
    "feuille": [
      "feuilles enroulées ou mangées par plaques"
    ]
  },
  "confusions": [],
  "conditions": {
    "ecosystemes": [],
    "altitude_m": [],
    "facteurs": []
  },
  "prevention": [
    "surveillance régulière de la parcelle",
    "élimination des adventices hôtes",
    "avis d'un technicien avant tout traitement"
  ],
  "lutte_chimique": {
    "statut": "a_completer_liste_DPV",
    "produits": []
  },
  "sources": [
    {
      "titre": "Ireo bibikely fahavalon'ny vary an-drano sy an-tanety aty Alaotra, 2017",
      "url": "https://www.fofifa.mg/wp-content/uploads/2020/07/KISARY-BIBIKELY.pdf"
    }
  ],
  "taxonomy_ids": [
    "degats_chenilles"
  ],
  "validation": {
    "par": null,
    "date": null,
    "statut": "brouillon"
  }
}
